{"schemaVersion":1,"capturedAt":"2026-08-07T12:27:04+08:00","sourceCommit":"efcc5a5ad2d119eac4c87f1a56ae7747f4a1b8f7","complete":true,"roots":[{"name":"00_Project_Management","driveFolderId":"1HGywCqfcGPAcUP7WOc2cbdwadhhH-K_q","directChildCount":1},{"name":"01_Design_And_Specs","driveFolderId":"1jRlNdGcfgunVzNG8Kc6zEjPXA4WeSlsC","directChildCount":2},{"name":"02_UI_UX_And_Visuals","driveFolderId":"1cH0KYWGvUT5ci57HW8JBFv3v-8uG51IC","directChildCount":2},{"name":"03_Game_Content_And_Data","driveFolderId":"1dq9is47CQSlIrQz-hVFnH4x7GIMEVltw","directChildCount":0},{"name":"04_Testing_And_Evidence","driveFolderId":"1q3u3eXoZ9EOiBlVYFqsjXWV_7hVbDjHD","directChildCount":0},{"name":"05_Releases_And_Store_Assets","driveFolderId":"1OG_EG-A8b985E8fk2y89XYNivFUIxgNC","directChildCount":0},{"name":"80_Inbox","driveFolderId":"1h_yncfl1MHcZy7IKrP3dGfmNC5lVGfuV","directChildCount":1},{"name":"90_Archive","driveFolderId":"1nqvBeExct6jW_1TJ-be_eGZ-wJIK-TJr","directChildCount":1}],"resources":[{"resourceKind":"folder","driveResourceId":"1HGywCqfcGPAcUP7WOc2cbdwadhhH-K_q","name":"00_Project_Management","parentDriveId":"1uF6Gzt8RnLkGAk02e_PXhnMcTHQQ72Nw","mimeType":"application/vnd.google-apps.folder","sizeBytes":null,"modifiedTime":"2026-08-05T22:55:39.045Z","webViewLink":"https://drive.google.com/drive/folders/1HGywCqfcGPAcUP7WOc2cbdwadhhH-K_q","folderKey":"project.management","assetRecordId":null,"lifecycleClaim":"none","directChildCount":1,"evidenceSource":"live-drive-scan"},{"resourceKind":"folder","driveResourceId":"1jRlNdGcfgunVzNG8Kc6zEjPXA4WeSlsC","name":"01_Design_And_Specs","parentDriveId":"1uF6Gzt8RnLkGAk02e_PXhnMcTHQQ72Nw","mimeType":"application/vnd.google-apps.folder","sizeBytes":null,"modifiedTime":"2026-08-05T22:55:44.211Z","webViewLink":"https://drive.google.com/drive/folders/1jRlNdGcfgunVzNG8Kc6zEjPXA4WeSlsC","folderKey":"project.design-specs","assetRecordId":null,"lifecycleClaim":"none","directChildCount":2,"evidenceSource":"live-drive-scan"},{"resourceKind":"folder","driveResourceId":"1cH0KYWGvUT5ci57HW8JBFv3v-8uG51IC","name":"02_UI_UX_And_Visuals","parentDriveId":"1uF6Gzt8RnLkGAk02e_PXhnMcTHQQ72Nw","mimeType":"application/vnd.google-apps.folder","sizeBytes":null,"modifiedTime":"2026-08-05T22:55:51.361Z","webViewLink":"https://drive.google.com/drive/folders/1cH0KYWGvUT5ci57HW8JBFv3v-8uG51IC","folderKey":"project.visuals","assetRecordId":null,"lifecycleClaim":"none","directChildCount":2,"evidenceSource":"live-drive-scan"},{"resourceKind":"folder","driveResourceId":"1dq9is47CQSlIrQz-hVFnH4x7GIMEVltw","name":"03_Game_Content_And_Data","parentDriveId":"1uF6Gzt8RnLkGAk02e_PXhnMcTHQQ72Nw","mimeType":"application/vnd.google-apps.folder","sizeBytes":null,"modifiedTime":"2026-08-05T22:55:56.806Z","webViewLink":"https://drive.google.com/drive/folders/1dq9is47CQSlIrQz-hVFnH4x7GIMEVltw","folderKey":"project.game-content","assetRecordId":null,"lifecycleClaim":"none","directChildCount":0,"evidenceSource":"live-drive-scan"},{"resourceKind":"folder","driveResourceId":"1q3u3eXoZ9EOiBlVYFqsjXWV_7hVbDjHD","name":"04_Testing_And_Evidence","parentDriveId":"1uF6Gzt8RnLkGAk02e_PXhnMcTHQQ72Nw","mimeType":"application/vnd.google-apps.folder","sizeBytes":null,"modifiedTime":"2026-08-05T22:56:03.446Z","webViewLink":"https://drive.google.com/drive/folders/1q3u3eXoZ9EOiBlVYFqsjXWV_7hVbDjHD","folderKey":"project.testing","assetRecordId":null,"lifecycleClaim":"none","directChildCount":0,"evidenceSource":"live-drive-scan"},{"resourceKind":"folder","driveResourceId":"1OG_EG-A8b985E8fk2y89XYNivFUIxgNC","name":"05_Releases_And_Store_Assets","parentDriveId":"1uF6Gzt8RnLkGAk02e_PXhnMcTHQQ72Nw","mimeType":"application/vnd.google-apps.folder","sizeBytes":null,"modifiedTime":"2026-08-05T22:56:09.570Z","webViewLink":"https://drive.google.com/drive/folders/1OG_EG-A8b985E8fk2y89XYNivFUIxgNC","folderKey":"project.releases","assetRecordId":null,"lifecycleClaim":"none","directChildCount":0,"evidenceSource":"live-drive-scan"},{"resourceKind":"folder","driveResourceId":"1h_yncfl1MHcZy7IKrP3dGfmNC5lVGfuV","name":"80_Inbox","parentDriveId":"1uF6Gzt8RnLkGAk02e_PXhnMcTHQQ72Nw","mimeType":"application/vnd.google-apps.folder","sizeBytes":null,"modifiedTime":"2026-08-05T22:56:17.575Z","webViewLink":"https://drive.google.com/drive/folders/1h_yncfl1MHcZy7IKrP3dGfmNC5lVGfuV","folderKey":"project.inbox","assetRecordId":null,"lifecycleClaim":"inbox","directChildCount":1,"evidenceSource":"live-drive-scan"},{"resourceKind":"folder","driveResourceId":"1nqvBeExct6jW_1TJ-be_eGZ-wJIK-TJr","name":"90_Archive","parentDriveId":"1uF6Gzt8RnLkGAk02e_PXhnMcTHQQ72Nw","mimeType":"application/vnd.google-apps.folder","sizeBytes":null,"modifiedTime":"2026-08-05T22:56:25.363Z","webViewLink":"https://drive.google.com/drive/folders/1nqvBeExct6jW_1TJ-be_eGZ-wJIK-TJr","folderKey":"project.archive","assetRecordId":null,"lifecycleClaim":"archive","directChildCount":1,"evidenceSource":"live-drive-scan"},{"resourceKind":"folder","driveResourceId":"16p7x1-uISZShEkppN68Fwqn-epm44Uok","name":"Asset_Control_Center","parentDriveId":"1HGywCqfcGPAcUP7WOc2cbdwadhhH-K_q","mimeType":"application/vnd.google-apps.folder","sizeBytes":null,"modifiedTime":"2026-08-07T02:06:41.615Z","webViewLink":"https://drive.google.com/drive/folders/16p7x1-uISZShEkppN68Fwqn-epm44Uok","folderKey":null,"assetRecordId":null,"lifecycleClaim":"reference","directChildCount":1,"evidenceSource":"live-drive-scan"},{"resourceKind":"file","driveResourceId":"1JwdPPz4cjx94MYE5qXJt2GaE67e9HUlzXPY4OPb6S94","name":"CICG_素材管理控制中心_v1.0","parentDriveId":"16p7x1-uISZShEkppN68Fwqn-epm44Uok","mimeType":"application/vnd.google-apps.spreadsheet","sizeBytes":38517,"modifiedTime":"2026-08-07T04:08:05.792Z","webViewLink":"https://docs.google.com/spreadsheets/d/1JwdPPz4cjx94MYE5qXJt2GaE67e9HUlzXPY4OPb6S94/edit?usp=drivesdk","folderKey":null,"assetRecordId":null,"lifecycleClaim":"reference","directChildCount":null,"evidenceSource":"live-drive-scan"},{"resourceKind":"file","driveResourceId":"1Pid94CrRA2bmVLzuLAe_eDqnZ-fEEIxfpfVG-Y7TF-4","name":"CICG_成語卡牌圖卡規範_v1.4","parentDriveId":"1jRlNdGcfgunVzNG8Kc6zEjPXA4WeSlsC","mimeType":"application/vnd.google-apps.document","sizeBytes":2500336,"modifiedTime":"2026-08-06T07:02:53.018Z","webViewLink":"https://docs.google.com/document/d/1Pid94CrRA2bmVLzuLAe_eDqnZ-fEEIxfpfVG-Y7TF-4/edit?usp=drivesdk","folderKey":null,"assetRecordId":null,"lifecycleClaim":"reference","directChildCount":null,"evidenceSource":"live-drive-scan"},{"resourceKind":"file","driveResourceId":"1zo99bQ2VAzCVQPtb5Jmdon2lT1jHNd_4Tuv7CeE2DyI","name":"CICG_成語卡牌標準模板_v2.5_Approved","parentDriveId":"1jRlNdGcfgunVzNG8Kc6zEjPXA4WeSlsC","mimeType":"application/vnd.google-apps.document","sizeBytes":2500335,"modifiedTime":"2026-08-06T07:00:11.660Z","webViewLink":"https://docs.google.com/document/d/1zo99bQ2VAzCVQPtb5Jmdon2lT1jHNd_4Tuv7CeE2DyI/edit?usp=drivesdk","folderKey":null,"assetRecordId":null,"lifecycleClaim":"reference","directChildCount":null,"evidenceSource":"live-drive-scan"},{"resourceKind":"folder","driveResourceId":"1VorW6bO2jZCDxhjC83qJf2l1TQuhauFm","name":"Idiom_Cards","parentDriveId":"1cH0KYWGvUT5ci57HW8JBFv3v-8uG51IC","mimeType":"application/vnd.google-apps.folder","sizeBytes":null,"modifiedTime":"2026-08-06T21:26:28.850Z","webViewLink":"https://drive.google.com/drive/folders/1VorW6bO2jZCDxhjC83qJf2l1TQuhauFm","folderKey":"idiom-cards.root","assetRecordId":null,"lifecycleClaim":"reference","directChildCount":6,"evidenceSource":"delegated-phase1-governance"},{"resourceKind":"folder","driveResourceId":"1v-xm8k4ufmr5J4bxCldce7YYU8SZuL1T","name":"Game_Backgrounds","parentDriveId":"1cH0KYWGvUT5ci57HW8JBFv3v-8uG51IC","mimeType":"application/vnd.google-apps.folder","sizeBytes":null,"modifiedTime":"2026-08-06T22:57:23.472Z","webViewLink":"https://drive.google.com/drive/folders/1v-xm8k4ufmr5J4bxCldce7YYU8SZuL1T","folderKey":null,"assetRecordId":null,"lifecycleClaim":"reference","directChildCount":3,"evidenceSource":"live-drive-scan"},{"resourceKind":"file","driveResourceId":"1t4zdMFWG9xrsQCVsPARrWCD8beM38DwMnFCuRzqQHEw","name":"CICG_遊戲背景圖產製提示語_v1.1_BD2_DOAX_Approved","parentDriveId":"1v-xm8k4ufmr5J4bxCldce7YYU8SZuL1T","mimeType":"application/vnd.google-apps.document","sizeBytes":6033,"modifiedTime":"2026-08-07T02:12:00.893Z","webViewLink":"https://docs.google.com/document/d/1t4zdMFWG9xrsQCVsPARrWCD8beM38DwMnFCuRzqQHEw/edit?usp=drivesdk","folderKey":null,"assetRecordId":null,"lifecycleClaim":"reference","directChildCount":null,"evidenceSource":"live-drive-scan"},{"resourceKind":"folder","driveResourceId":"1i1OZ7qWPhu-YY2bbPUGXb5KHaOLh3NAI","name":"10_Review","parentDriveId":"1v-xm8k4ufmr5J4bxCldce7YYU8SZuL1T","mimeType":"application/vnd.google-apps.folder","sizeBytes":null,"modifiedTime":"2026-08-07T02:12:28.361Z","webViewLink":"https://drive.google.com/drive/folders/1i1OZ7qWPhu-YY2bbPUGXb5KHaOLh3NAI","folderKey":null,"assetRecordId":null,"lifecycleClaim":"review","directChildCount":7,"evidenceSource":"live-drive-scan"},{"resourceKind":"folder","driveResourceId":"1VX-nfxg0JUiuw-oBJkTVtLwNJR3auB3_","name":"20_Approved","parentDriveId":"1v-xm8k4ufmr5J4bxCldce7YYU8SZuL1T","mimeType":"application/vnd.google-apps.folder","sizeBytes":null,"modifiedTime":"2026-08-07T02:12:41.133Z","webViewLink":"https://drive.google.com/drive/folders/1VX-nfxg0JUiuw-oBJkTVtLwNJR3auB3_","folderKey":null,"assetRecordId":null,"lifecycleClaim":"approved","directChildCount":0,"evidenceSource":"live-drive-scan"},{"resourceKind":"file","driveResourceId":"1Ygo9pJmQoRvdUalyrk-Ukd-LsoiA5jL7","name":"CICG_BG_01_Home_Portrait_v1.0_Review.png","parentDriveId":"1i1OZ7qWPhu-YY2bbPUGXb5KHaOLh3NAI","mimeType":"image/png","sizeBytes":2147544,"modifiedTime":"2026-08-07T02:13:11.705Z","webViewLink":"https://drive.google.com/file/d/1Ygo9pJmQoRvdUalyrk-Ukd-LsoiA5jL7/view?usp=drivesdk","folderKey":null,"assetRecordId":null,"lifecycleClaim":"review","directChildCount":null,"evidenceSource":"live-drive-scan"},{"resourceKind":"file","driveResourceId":"1JfSu6hoG628J4I0hNfbAZrqBzcQ2KTny","name":"CICG_BG